title,num_subscribers,course_type,level,subject,language,subtitles,price,type_ins,duration_interval
China’s First Empires and the Rise of Buddhism,46053,Self-paced on your time,Introductory,History,English,"English, 中文",139.0,University,30-40h
Apnea y Trastornos del Sueño,14902,Self-paced on your time,Introductory,Health & Safety,Español,Español,49.0,University,80h+
Educación sobre el cambio climático,23253,Self-paced on your time,Introductory,Education & Teacher Training,Español,Español,25.0,Other,40-50h
Quantum Mechanics: A First Course,0,Instructor-led on a course schedule,Advanced,Physics,English,English,149.0,Institute,80h+
Urban Sewage Treatment,40408,Self-paced on your time,Intermediate,Engineering,English,English,50.0,University,40-50h
Doing Gender and Why it Matters,6826,Self-paced on your time,Introductory,Social Sciences,English,English,99.0,University,0-10h
Producción musical y su efecto en la composición,7869,Self-paced on your time,Introductory,Music,Español,Español,49.0,University,20-30h
"Principle of Semiconductor Devices Part I: Semiconductors, PN Junctions and Bipolar Junction Transistors",12425,Self-paced on your time,Intermediate,Electronics,English,"English, 中文",70.0,University,20-30h
"19th-Century Opera: Meyerbeer, Wagner, & Verdi",9340,Self-paced on your time,Introductory,Music,English,English,99.0,University,20-30h
Modelos predictivos con Machine Learning,5102,Self-paced on your time,Intermediate,Computer Science,Español,Español,49.0,University,20-30h
Quantitative Marketing Research,0,Self-paced on your time,Introductory,Business & Management,English,English,50.0,Institute,10-20h
Les fondements de la stratégie d’entreprise,33021,Instructor-led on a course schedule,Introductory,Business & Management,Français,Français,150.0,University,40-50h
Solar Energy: Integration of Photovoltaic Systems in Microgrids,20068,Instructor-led on a course schedule,Advanced,Engineering,English,English,250.0,University,80h+
"Automated Software Testing: Unit Testing, Coverage Criteria and Design for Testability",12630,Self-paced on your time,Intermediate,Computer Science,English,English,99.0,University,20-30h
Probability and Statistics I:  A Gentle Introduction to Probability,0,Self-paced on your time,Intermediate,Data Analysis & Statistics,English,English,199.0,Institute,20-30h
Introducción a las ecuaciones diferenciales,9868,Self-paced on your time,Intermediate,Math,Español,Español,49.0,University,30-40h
Agile Mindset Introduction,0,Self-paced on your time,Introductory,Data Analysis & Statistics,English,English,49.0,Other,0-10h
Tropical coastal ecosystems,23031,Self-paced on your time,Introductory,Biology & Life Sciences,English,English,99.0,University,40-50h
Modern China’s Foundations: The Manchus and the Qing,47166,Self-paced on your time,Introductory,History,English,"English, 中文",139.0,University,30-40h
El método de ciencia de datos,0,Self-paced on your time,Introductory,Data Analysis & Statistics,Español,Español,39.0,Other,30-40h
AWS Developer: Deploying on AWS,25244,Self-paced on your time,Advanced,Computer Science,English,English,149.0,Other,20-30h
Autonomous Mobile Robots,62362,Self-paced on your time,Intermediate,Computer Science,English,English,50.0,Other,80h+
Gestión por resultados para gobiernos subnacionales,65955,Self-paced on your time,Introductory,Business & Management,Español,Español,25.0,Other,30-40h
Introduction to Sociology,10412,Self-paced on your time,Introductory,Social Sciences,English,English,139.0,University,30-40h
Transformación digital en las empresas,0,Self-paced on your time,Introductory,Business & Management,Español,Español,49.0,University,30-40h
Desafios e oportunidades na economia digital,6913,Self-paced on your time,Introductory,Economics & Finance,Português,Português,25.0,Other,20-30h
"Cellular Solids Part 1: Structures, Properties and Engineering Applications",7186,Self-paced on your time,Advanced,Engineering,English,English,99.0,Institute,80h+
Introduction to Statistical Methods for Gene Mapping,15419,Self-paced on your time,Advanced,Data Analysis & Statistics,English,English,49.0,University,10-20h
Cómo vivir una vida saludable y activa,8990,Self-paced on your time,Introductory,Social Sciences,Español,Español,49.0,University,10-20h
Mandarin Chinese Level 3,8418,Self-paced on your time,Intermediate,Language,English,English,149.0,Other,40-50h
Databases: Advanced Topics in SQL,0,Self-paced on your time,Introductory,Computer Science,English,English,50.0,University,10-20h
Data for Effective Policy Making,13797,Self-paced on your time,Introductory,Math,English,English,25.0,Other,30-40h
C Programming: Using Linux Tools and Libraries,13912,Self-paced on your time,Intermediate,Computer Science,English,English,49.0,University,30-40h
Lernen objekt-orientierter Programmierung,10657,Instructor-led on a course schedule,Introductory,Computer Science,Deutsch,Deutsch,49.0,University,20-30h
Cybersecurity: The CISO's View,21507,Self-paced on your time,Introductory,Computer Science,English,English,199.0,University,20-30h
Fundamentals of Java EE Development,10129,Self-paced on your time,Intermediate,Computer Science,English,English,99.0,Other,10-20h
"Instructional Design: Digital Media, New Tools and Technology",16419,Self-paced on your time,Intermediate,Education & Teacher Training,English,English,299.0,University,70-80h
Molecular Biology – Part 3: RNA Processing and Translation,16520,Self-paced on your time,Advanced,Biology & Life Sciences,English,"English, 中文",99.0,Institute,40-50h
Power and Responsibility: Doing Philosophy with Superheroes,8517,Self-paced on your time,Introductory,Art & Culture,English,English,49.0,Other,10-20h
Aprendizaje automático y ciencia de datos,13994,Self-paced on your time,Intermediate,Computer Science,Español,Español,50.0,University,20-30h
Sustainable Urban Freight Transport: A Global Perspective,7769,Self-paced on your time,Introductory,Engineering,English,English,50.0,University,20-30h
MathTrackX: Statistics,0,Self-paced on your time,Introductory,Math,English,English,79.0,University,10-20h
Técnicas Cuantitativas y Cualitativas para la Investigación,29885,Self-paced on your time,Intermediate,Data Analysis & Statistics,Español,Español,65.0,University,10-20h
Strategic Applications of IT Project & Program Management,17914,Self-paced on your time,Introductory,Business & Management,English,English,199.0,University,20-30h
Advanced Bioconductor,26063,Self-paced on your time,Advanced,Data Analysis & Statistics,English,English,149.0,University,10-20h
What Every Provider Should Know: Clinical Fundamentals,0,Self-paced on your time,Introductory,Medicine,English,English,50.0,University,50-60h
Análisis e interpretación de información económica y financiera,5891,Self-paced on your time,Intermediate,Economics & Finance,Español,Español,49.0,University,30-40h
AWS IoT: Developing and Deploying an Internet of Things,8884,Self-paced on your time,Intermediate,Computer Science,English,English,99.0,Other,10-20h
Measuring Sustainable Development,0,Self-paced on your time,Intermediate,Data Analysis & Statistics,English,English,25.0,Other,10-20h
Embedded Systems - Shape The World: Multi-Threaded Interfacing,27814,Self-paced on your time,Intermediate,Computer Science,English,English,49.0,University,70-80h
Hong Kong Cinema through a Global Lens | 全球化下的香港电影,12458,Instructor-led on a course schedule,Introductory,Humanities,English,"English, 中文",50.0,University,30-40h
Image Processing and Analysis for Life Scientists,8621,Self-paced on your time,Intermediate,Data Analysis & Statistics,English,English,199.0,Other,10-20h
La protección del menor,7654,Self-paced on your time,Introductory,Law,Español,Español,49.0,University,20-30h
Globalization: Past and Future,10127,Self-paced on your time,Introductory,History,English,"English, Русский",25.0,Other,10-20h
Star Trek: Inspiring Culture and Technology,6521,Self-paced on your time,Introductory,History,English,English,40.0,Other,10-20h
Qué funciona en educación: políticas educativas basadas en evidencia,15701,Self-paced on your time,Introductory,Education & Teacher Training,Español,Español,25.0,Other,30-40h
"Introduction to Cloud Development with HTML5, CSS3, and JavaScript",0,Self-paced on your time,Introductory,Computer Science,English,English,99.0,Other,0-10h
Tools for Academic Engagement in Public Policy,5035,Self-paced on your time,Introductory,Communication,English,English,199.0,Institute,0-10h
Theory of Change for Development,10736,Self-paced on your time,Introductory,Social Sciences,English,English,199.0,University,20-30h
Monozukuri: Making Things,0,Self-paced on your time,Introductory,Engineering,English,English,49.0,Institute,0-10h
Drug Discovery & Medicinal Chemistry,0,Self-paced on your time,Intermediate,Medicine,English,English,99.0,University,30-40h
Digital Biomaterials,0,Self-paced on your time,Introductory,Medicine,English,English,149.0,University,10-20h
Natural Resources for Sustainable Development,9668,Self-paced on your time,Intermediate,Energy & Earth Sciences,English,"اللغة العربية, English, Español, Français, Русский",49.0,Other,60-70h
Omnichannel Strategy and Management,15860,Self-paced on your time,Intermediate,Business & Management,English,English,99.0,University,10-20h
General Overview of Cannabis and the Industry’s Outlook and Professions,5048,Self-paced on your time,Introductory,Environmental Studies,English,English,199.0,University,30-40h
Amazon SageMaker: Simplifying Machine Learning Application Development,11765,Self-paced on your time,Intermediate,Computer Science,English,English,99.0,Other,10-20h
Formulación y nomenclatura de compuestos químicos,12748,Self-paced on your time,Introductory,Chemistry,Español,Español,49.0,University,20-30h
Introducción a la factura electrónica,5829,Self-paced on your time,Intermediate,Economics & Finance,Español,Español,49.9,Other,10-20h
Demand and Supply Analytics,23585,Instructor-led on a course schedule,Intermediate,Business & Management,English,English,249.0,University,80h+
Advanced Algorithmics and Graph Theory with Python,13502,Self-paced on your time,Intermediate,Computer Science,English,English,49.0,Other,10-20h
Modern Japanese Architecture Part 1: From Meiji Restoration to the Pacific War,0,Self-paced on your time,Intermediate,Architecture,English,English,59.0,Institute,20-30h
Diagramas UML estructurales para la Ingeniería del Software,5820,Self-paced on your time,Introductory,Computer Science,Español,Español,50.0,University,10-20h
"A-level Mathematics for Year 12 - Course 2: Calculus, Newton’s Laws and Hypothesis Testing",6232,Self-paced on your time,Intermediate,Math,English,English,49.0,University,20-30h
Fundamentos de Mecánica para Ingeniería,14219,Self-paced on your time,Introductory,Physics,Español,Español,49.0,University,20-30h
Leadership and Management for PM Practitioners in IT,21949,Self-paced on your time,Introductory,Business & Management,English,English,199.0,University,20-30h
Entrepreneurship 103: Show Me The Money,15184,Self-paced on your time,Introductory,Business & Management,English,English,300.0,Institute,30-40h
Historia de la ética,9383,Self-paced on your time,Introductory,Philosophy & Ethics,Español,Español,29.0,University,10-20h
Drainage in Agriculture: controlling water and salt levels in the soil,0,Self-paced on your time,Advanced,Environmental Studies,English,English,49.0,University,80h+
Radio para internet con Podcast: creación y conceptos básicos,6460,Self-paced on your time,Introductory,Communication,Español,Español,50.0,University,20-30h
Introducción a los circuitos eléctricos,11953,Self-paced on your time,Intermediate,Electronics,Español,Español,49.0,University,30-40h
AP® Physics 1: Challenging Concepts,12145,Self-paced on your time,Introductory,Physics,English,English,49.0,Other,20-30h
Introduction to Java Programming – Part 2,71203,Self-paced on your time,Introductory,Computer Science,English,English,99.0,University,20-30h
AP® Macroeconomics,29433,Self-paced on your time,Introductory,Economics & Finance,English,English,49.0,Other,50-60h
Climate Change Education,12056,Self-paced on your time,Introductory,Education & Teacher Training,English,"English, Español",25.0,Other,40-50h
"Introducción al griego clásico: verbos, oraciones y filosofía",0,Self-paced on your time,Introductory,Language,Español,Español,49.0,University,20-30h
Applied Deep Learning Capstone Project,8429,Self-paced on your time,Advanced,Data Analysis & Statistics,English,English,99.0,Other,10-20h
FinTech Ethics and Risks,10696,Self-paced on your time,Introductory,Economics & Finance,English,"English, English, 中文, 中文",199.0,University,10-20h
User Experience (UX) Design: Human Factors and Culture in Design | 设计的人因与文化,23828,Self-paced on your time,Advanced,Engineering,English,English,139.0,University,20-30h
The Conquest of Space: Space Exploration and Rocket Science,19926,Self-paced on your time,Introductory,Engineering,English,English,129.0,University,20-30h
Business Strategy and Operations in a Biobased Economy,0,Self-paced on your time,Advanced,Business & Management,English,English,149.0,University,70-80h
What Works in Education: Evidence-Based Education Policies,5540,Self-paced on your time,Introductory,Education & Teacher Training,English,English,25.0,Other,30-40h
Electric Cars: Business,14199,Self-paced on your time,Intermediate,Business & Management,English,English,50.0,University,10-20h
Thermodynamics of Materials,0,Self-paced on your time,Intermediate,Engineering,English,English,150.0,Institute,80h+
Mechanics: Momentum and Energy,14846,Self-paced on your time,Intermediate,Physics,English,English,49.0,Institute,80h+
Co-Creating Sustainable Cities,12415,Self-paced on your time,Advanced,Social Sciences,English,English,49.0,University,50-60h
Cómo educar teniendo en cuenta la muerte,0,Self-paced on your time,Introductory,Education & Teacher Training,Español,Español,49.0,University,10-20h
Introduction to Animal Ethics,6608,Self-paced on your time,Introductory,Philosophy & Ethics,English,English,49.0,University,10-20h
Teamwork & Collaboration,0,Self-paced on your time,Introductory,Communication,English,English,199.0,Institute,10-20h
Grant Writing and Crowdfunding for Public Libraries,12853,Self-paced on your time,Introductory,Humanities,English,English,49.0,University,10-20h
Leading Ambitious Teaching and Learning,24273,Self-paced on your time,Advanced,Education & Teacher Training,English,English,199.0,University,10-20h
Financing Innovative Ventures,0,Self-paced on your time,Introductory,Business & Management,English,English,149.0,University,10-20h
"A-level Mathematics for Year 13 - Course 2: General Motion, Moments and Equilibrium, The Normal Distribution, Vectors, Differentiation Methods, Integration Methods and Differential Equations",0,Self-paced on your time,Intermediate,Math,English,English,49.0,University,20-30h
Theories of Media and Technology,0,Instructor-led on a course schedule,Introductory,Art & Culture,English,English,249.0,University,80h+
Introducción a la Estructura de la Materia,11859,Self-paced on your time,Introductory,Chemistry,Español,Español,25.0,University,10-20h
"Batteries, Fuel Cells, and their Role in Modern Society",11865,Self-paced on your time,Introductory,Science,English,English,49.0,University,10-20h
Communication Skills for Dialoguing Across Difference,60943,Self-paced on your time,Introductory,Communication,English,English,25.0,Other,0-10h
Social Media: How Media Got Social,13616,Self-paced on your time,Introductory,Communication,English,English,139.0,University,10-20h
"Portfolio Management, Governance, & the PMO",17299,Self-paced on your time,Introductory,Business & Management,English,English,199.0,University,20-30h
edX101: Overview of Creating an edX Course,22327,Self-paced on your time,Introductory,Education & Teacher Training,English,English,99.0,Other,0-10h
"Soy docente, ¡qué miedo! Gestiona eficazmente tus emociones",0,Self-paced on your time,Introductory,Education & Teacher Training,Español,Español,49.0,University,10-20h
Data Analysis for Decision Making,8342,Instructor-led on a course schedule,Advanced,Business & Management,English,English,214.0,University,60-70h
UML Class Diagrams for Software Engineering,33710,Self-paced on your time,Introductory,Computer Science,English,English,49.0,University,10-20h
Driving Digital Innovation through Experimentation,16904,Instructor-led on a course schedule,Advanced,Computer Science,English,English,399.0,University,20-30h
Compilation Basics for Macroeconomic Statistics,6570,Self-paced on your time,Introductory,Data Analysis & Statistics,English,English,25.0,Other,10-20h
Seguridad Vial en América Latina y el Caribe: de la teoría a la acción,20189,Self-paced on your time,Introductory,Engineering,Español,Español,25.0,Other,20-30h
From Fossil Resources to Biomass: A Chemistry Perspective,5464,Self-paced on your time,Advanced,Energy & Earth Sciences,English,English,149.0,University,80h+
System Dynamics for Health Sciences,15157,Self-paced on your time,Intermediate,Medicine,English,English,139.0,University,20-30h
Internet de las cosas (IoT) y Big Data,0,Self-paced on your time,Intermediate,Data Analysis & Statistics,Español,Español,49.0,University,20-30h
Introducción a Ciencias de Datos y Estadística Básica para Negocios,0,Self-paced on your time,Advanced,Data Analysis & Statistics,Español,Español,49.99,Other,20-30h
Introduction to Psychological Research Methods,17087,Self-paced on your time,Introductory,Humanities,English,English,99.0,University,10-20h
Sustainable Packaging in a Circular Economy,6277,Self-paced on your time,Intermediate,Design,English,English,50.0,University,20-30h
Design in Healthcare: Using Patient Journey Mapping,17946,Self-paced on your time,Introductory,Design,English,English,129.0,University,20-30h
"El manejo de plagas, malezas y enfermedades en los Sistemas de Siembra Directa",0,Self-paced on your time,Intermediate,Biology & Life Sciences,Español,"English, Español",99.0,University,20-30h
"Electronic, Optical, and Magnetic Properties of Materials",9717,Instructor-led on a course schedule,Advanced,Engineering,English,English,150.0,Institute,80h+
La España del Quijote,13277,Self-paced on your time,Introductory,History,Español,Español,19.0,University,40-50h
Risk Management for Projects,22269,Self-paced on your time,Introductory,Business & Management,English,English,199.0,University,10-20h
Smithsonian’s Objects That Define America,9071,Self-paced on your time,Introductory,Humanities,English,English,50.0,Other,0-10h
Creating Modern China: The Republican Period to the Present,43045,Self-paced on your time,Introductory,History,English,"English, 中文",139.0,University,30-40h
Discover Political Science,6573,Instructor-led on a course schedule,Intermediate,Social Sciences,English,English,50.0,University,50-60h
Data Science: Inferential Thinking through Simulations,17505,Self-paced on your time,Introductory,Computer Science,English,English,199.0,University,20-30h
Programming for Data Science,41268,Self-paced on your time,Introductory,Computer Science,English,English,199.0,University,80h+
Public Sector Debt Statistics,0,Self-paced on your time,Intermediate,Economics & Finance,English,English,25.0,Other,40-50h
Sensor Fusion and Non-linear Filtering for Automotive Systems,9709,Instructor-led on a course schedule,Advanced,Engineering,English,English,299.0,University,80h+
Creación musical con Soundcool: Introducción,0,Self-paced on your time,Introductory,Music,Español,Español,30.0,University,20-30h
First Nights - Berlioz’s Symphonie Fantastique and Program Music in the 19th Century,8222,Self-paced on your time,Introductory,Humanities,English,English,49.0,University,10-20h
The Quantum Internet and Quantum Computers: How Will They Change the World?,15014,Self-paced on your time,Introductory,Science,English,English,50.0,University,10-20h
Research Methods: An Engineering Approach,20444,Self-paced on your time,Introductory,Engineering,English,English,169.0,University,20-30h
Idealismo filosófico y cosmovisiones: cómo hacer mundos con ideas,15349,Self-paced on your time,Introductory,Philosophy & Ethics,Español,Español,49.0,University,20-30h
Rise to Leadership: Become a CEO,16719,Self-paced on your time,Intermediate,Business & Management,English,English,199.0,University,20-30h
Building a Cybersecurity Toolkit,23275,Self-paced on your time,Introductory,Computer Science,English,English,199.0,University,20-30h
Marketing your Android apps,0,Self-paced on your time,Intermediate,Engineering,English,English,49.0,University,30-40h
Embedded Systems Essentials with Arm: Getting Started,0,Self-paced on your time,Intermediate,Computer Science,English,English,149.0,Other,20-30h
Life with Diabetes,12318,Self-paced on your time,Introductory,Medicine,English,English,139.0,University,10-20h
Human Reproduction,5517,Self-paced on your time,Intermediate,Biology & Life Sciences,English,English,169.0,University,10-20h
Enabling Technologies for Data Science and Analytics: The Internet of Things,71290,Self-paced on your time,Introductory,Computer Science,English,English,99.0,University,40-50h
Astrophysics: Exploring Exoplanets,48539,Self-paced on your time,Intermediate,Physics,English,English,50.0,University,20-30h
Unconventional Reservoir Geomechanics,0,Self-paced on your time,Introductory,Energy & Earth Sciences,English,English,129.0,University,70-80h
Strategic Account Management,0,Self-paced on your time,Introductory,Business & Management,English,English,149.0,University,30-40h
PyTorch Basics for Machine Learning,0,Self-paced on your time,Introductory,Data Analysis & Statistics,English,English,39.0,Other,20-30h
Diseño y Desarrollo de Recursos Multimedia para la Enseñanza Virtual,14266,Self-paced on your time,Intermediate,Humanities,Español,Español,49.0,University,10-20h
Introduction to Cloud Foundry and Cloud Native Software Architecture,24444,Self-paced on your time,Introductory,Computer Science,English,English,169.0,Other,40-50h
Gestión de compras eficientes para tu empresa,0,Self-paced on your time,Introductory,Engineering,Español,Español,25.0,Other,20-30h
Know HBV And HCV,0,Self-paced on your time,Introductory,Medicine,English,English,50.0,University,0-10h
The Supreme Court & American Politics,6216,Self-paced on your time,Introductory,Law,English,English,29.0,University,40-50h
Sales Enablement & Analytics,0,Self-paced on your time,Introductory,Business & Management,English,English,149.0,University,30-40h
Inversión Extranjera como Motor del Desarrollo para América Latina y el Caribe,16423,Self-paced on your time,Intermediate,Business & Management,Español,Español,25.0,Other,30-40h
Liderazgo en la empresa familiar,10969,Self-paced on your time,Intermediate,Business & Management,Español,Español,49.0,Other,40-50h
Comparative Political Systems,6934,Self-paced on your time,Introductory,Social Sciences,English,English,59.0,University,30-40h
Introducción al Derecho en la vida cotidiana,0,Self-paced on your time,Introductory,Law,Español,Español,49.0,University,20-30h
Cloud Computing for Enterprises,27241,Instructor-led on a course schedule,Intermediate,Computer Science,English,English,299.0,University,70-80h
Diversity and Social Justice in Social Work,11055,Self-paced on your time,Advanced,Social Sciences,English,English,199.0,University,70-80h
Public Library Marketing and Public Relations,7525,Self-paced on your time,Introductory,Humanities,English,English,49.0,University,10-20h
"Healthcare Finance, Economics and Risk",8006,Self-paced on your time,Intermediate,Economics & Finance,English,English,199.0,University,30-40h
Reacciones Químicas y Cálculos Estequiométricos,8907,Self-paced on your time,Introductory,Chemistry,Español,Español,49.0,University,20-30h
Seeking Women’s Rights: Colonial Period to the Civil War,5157,Self-paced on your time,Intermediate,History,English,English,50.0,University,20-30h
VideoX: Creating Video for the edX Platform,12159,Self-paced on your time,Introductory,Education & Teacher Training,English,English,99.0,Other,0-10h
Comisión de la Verdad Colombia,0,Self-paced on your time,Introductory,History,Español,Español,29.0,University,40-50h
MathTrackX: Probability,0,Self-paced on your time,Introductory,Math,English,English,79.0,University,10-20h
Health Informatics for better and safer healthcare,0,Self-paced on your time,Introductory,Health & Safety,English,English,49.0,Other,10-20h
Sign Language Science: Factors Contributing to Natural Change,0,Self-paced on your time,Introductory,Language,English,English,99.0,University,10-20h
Accounting System Structure and Information Management,0,Self-paced on your time,Introductory,Economics & Finance,English,English,50.0,Other,0-10h
Sustainable Development: The Post-Capitalist Order,7031,Self-paced on your time,Introductory,Economics & Finance,English,English,49.0,Other,20-30h
"Health Law, Policy, and Advocacy",6358,Self-paced on your time,Intermediate,Law,English,English,199.0,University,30-40h
Introduction to Haptics,0,Self-paced on your time,Introductory,Engineering,English,English,129.0,University,20-30h
Gestión de inventario y portafolio,0,Self-paced on your time,Introductory,Engineering,Español,Español,25.0,Other,20-30h
Understanding Nuclear Energy,16015,Self-paced on your time,Intermediate,Engineering,English,English,50.0,University,30-40h
Cómo Convertirse en un Líder Exitoso (Entrenamiento de Liderazgo Inclusivo),11431,Self-paced on your time,Introductory,Business & Management,Español,Español,50.0,Other,0-10h
Decision Making Under Uncertainty: Introduction to Structured Expert Judgment,0,Self-paced on your time,Introductory,Business & Management,English,English,50.0,University,30-40h
AP® Calculus BC,8542,Self-paced on your time,Introductory,Math,English,English,49.0,Other,30-40h
