title,num_subscribers,course_type,level,subject,language,subtitles,price,type_ins,duration_interval
"Financial Programming and Policies, Part 1: Macroeconomic Accounts & Analysis",31024,Self-paced on your time,Intermediate,Economics & Finance,English,English,25.0,Other,50-60h
IoT System Design: Software and Hardware Integration,13608,Self-paced on your time,Intermediate,Computer Science,English,English,99.0,University,20-30h
English for Doing Business in Asia – Writing,44252,Self-paced on your time,Introductory,Humanities,English,English,60.0,University,20-30h
Working in Teams: A Practical Guide,43981,Self-paced on your time,Introductory,Humanities,English,English,49.0,University,20-30h
Introducción a los encofrados y las cimbras en obra civil y edificación,16029,Self-paced on your time,Introductory,Engineering,Español,Español,50.0,University,10-20h
AI Chatbots without Programming,35440,Self-paced on your time,Introductory,Computer Science,English,English,99.0,Other,0-10h
Introducción a la Ciencia de Datos y el Big Data,16268,Self-paced on your time,Intermediate,Data Analysis & Statistics,Español,Español,49.0,Other,10-20h
Just Money: Banking as if Society Mattered,25553,Self-paced on your time,Introductory,Business & Management,English,English,49.0,Institute,50-60h
Introducción a R,6431,Self-paced on your time,Introductory,Data Analysis & Statistics,Español,Español,49.0,University,20-30h
Computing in Python IV: Objects & Algorithms,28112,Self-paced on your time,Introductory,Computer Science,English,English,99.0,Institute,40-50h
Adobe Illustrator: aprende a crear presentaciones de impacto,18613,Self-paced on your time,Introductory,Design,Español,Español,15.0,University,40-50h
Teaching Critical Thinking through Art with the National Gallery of Art,18595,Self-paced on your time,Introductory,Education & Teacher Training,English,"English, Español, Français, 中文",25.0,Other,50-60h
Word intermedio: herramientas de formato y productividad,10265,Self-paced on your time,Intermediate,Computer Science,Español,Español,50.0,University,20-30h
Introducción a las finanzas: Principios de valoración,17344,Self-paced on your time,Intermediate,Economics & Finance,Español,Español,49.0,University,30-40h
Aprende a diseñar jardines verticales y cuadros vivos,6341,Self-paced on your time,Introductory,Biology & Life Sciences,Español,Español,29.0,University,0-10h
"Anatomy: Cardiovascular, Urinary, and Respiratory Systems",36917,Self-paced on your time,Introductory,Biology & Life Sciences,English,English,49.0,University,10-20h
Software Engineering: Introduction,35524,Self-paced on your time,Advanced,Computer Science,English,English,125.0,University,50-60h
Structure of Materials,13042,Self-paced on your time,Intermediate,Engineering,English,English,150.0,Institute,80h+
Fundamentos de fotografía documental,13036,Self-paced on your time,Introductory,Art & Culture,Español,Español,49.0,University,30-40h
AP® Italian Language and Culture (2020-2021),39398,Self-paced on your time,Advanced,Humanities,Italiano,Italiano,49.0,University,60-70h
Computer Hardware and Operating Systems,9715,Self-paced on your time,Introductory,Computer Science,English,English,150.0,University,20-30h
Marketing Management,43415,Instructor-led on a course schedule,Advanced,Business & Management,English,English,214.0,University,60-70h
You Can Innovate: User  Innovation & Entrepreneurship,18974,Self-paced on your time,Introductory,Business & Management,English,English,49.0,Institute,30-40h
Analytics in Python,82210,Instructor-led on a course schedule,Intermediate,Business & Management,English,Sin dato,249.0,University,80h+
Bases Matemáticas: Álgebra,35811,Self-paced on your time,Introductory,Math,Español,Español,50.0,University,10-20h
HTML5 Apps and Games,86850,Self-paced on your time,Advanced,Computer Science,English,English,199.0,Other,20-30h
MATLAB and Octave for Beginners,68706,Self-paced on your time,Introductory,Computer Science,English,English,139.0,Other,20-30h
AP Physics 1,43401,Self-paced on your time,Introductory,Physics,English,English,49.0,University,60-70h
The Divine Comedy: Dante's Journey to Freedom,12005,Self-paced on your time,Introductory,Humanities,English,English,49.0,University,70-80h
Linux Basics: The Command Line Interface,32726,Self-paced on your time,Introductory,Computer Science,English,English,49.0,University,20-30h
Entrepreneurial Operations: Launching a Startup,23808,Self-paced on your time,Intermediate,Business & Management,English,English,149.0,University,20-30h
Maths Essentials,44642,Self-paced on your time,Introductory,Business & Management,English,English,79.0,University,20-30h
"Marketing Analytics: Products, Distribution and Sales",50588,Self-paced on your time,Intermediate,Computer Science,English,English,249.0,University,20-30h
Marketing Innovative Products and Services,6293,Self-paced on your time,Introductory,Business & Management,English,English,149.0,University,10-20h
Just Reading and Writing in English | 生活英语读写,33303,Self-paced on your time,Introductory,Art & Culture,English,English,149.0,University,40-50h
Introduction to Java Programming – Part 1,270376,Self-paced on your time,Introductory,Computer Science,English,English,99.0,University,20-30h
Comunicación y Redacción Digital,7165,Self-paced on your time,Introductory,Communication,Español,Español,29.0,University,10-20h
Monetary Policy Analysis and Forecasting,6616,Self-paced on your time,Advanced,Economics & Finance,English,English,25.0,Other,50-60h
Basic Analytical Chemistry,19010,Self-paced on your time,Introductory,Chemistry,English,English,49.0,University,20-30h
Identifying Entrepreneurial Opportunities,11922,Self-paced on your time,Introductory,Business & Management,English,English,149.0,University,10-20h
"ChinaX Book Club: Five Authors, Five Books, Five Views of China",5855,Self-paced on your time,Introductory,Literature,English,English,139.0,University,0-10h
Astrophysics: Cosmology,83322,Self-paced on your time,Intermediate,Physics,English,English,50.0,University,30-40h
Japanese Culture and Language (I) |日语与日本文化（1）,18489,Self-paced on your time,Introductory,Art & Culture,中文,"日本語, 中文",139.0,University,40-50h
COVID-19 Training for Healthcare Workers,5742,Self-paced on your time,Introductory,Medicine,English,English,10.0,University,10-20h
The Rise of Superheroes and Their Impact On Pop Culture,31368,Self-paced on your time,Introductory,Humanities,English,English,50.0,Other,0-10h
Introduction to Aeronautical Engineering,99971,Self-paced on your time,Introductory,Engineering,English,English,50.0,University,70-80h
Diseño de Jardines,5683,Self-paced on your time,Introductory,Biology & Life Sciences,Español,Español,29.0,University,0-10h
"Introducción al griego clásico: lengua, nombres y mitología",18849,Self-paced on your time,Introductory,Language,Español,Español,49.0,University,20-30h
Deep Learning Fundamentals with Keras,32140,Self-paced on your time,Intermediate,Data Analysis & Statistics,English,English,99.0,Other,10-20h
Existential Well-being Counseling: A Person-centered Experiential Approach,48439,Self-paced on your time,Introductory,Humanities,English,English,49.0,University,80h+
Solid Waste Management,7668,Self-paced on your time,Introductory,Environmental Studies,English,English,5.0,Other,10-20h
Retail Fundamentals,37558,Self-paced on your time,Intermediate,Business & Management,English,English,99.0,University,10-20h
Greatest Unsolved Mysteries of the Universe,93965,Self-paced on your time,Intermediate,Physics,English,English,50.0,University,20-30h
"Money Markets, Foreign Exchange and Time Value of Money",12230,Self-paced on your time,Introductory,Economics & Finance,English,English,199.0,Other,0-10h
Gestión de Contenidos Digitales y Marketing Turístico de Ciudad,14627,Self-paced on your time,Introductory,Communication,Español,Español,49.0,University,30-40h
Designing the User Experience,6416,Self-paced on your time,Introductory,Business & Management,English,English,199.0,University,10-20h
Introduction to Bioconductor,36370,Self-paced on your time,Intermediate,Data Analysis & Statistics,English,English,149.0,University,10-20h
Connected Strategy,10355,Self-paced on your time,Intermediate,Business & Management,English,English,199.0,University,10-20h
Hybrid Vehicles,18294,Instructor-led on a course schedule,Advanced,Engineering,English,English,249.0,University,80h+
First Nights - Handel's Messiah and Baroque Oratorio,18029,Self-paced on your time,Introductory,Humanities,English,English,49.0,University,10-20h
Statistical Inference and Modeling for High-throughput Experiments,51590,Self-paced on your time,Intermediate,Data Analysis & Statistics,English,English,149.0,University,10-20h
First Nights - Monteverdi’s L’Orfeo and the Birth of Opera,13300,Self-paced on your time,Introductory,Humanities,English,English,49.0,University,10-20h
18th-Century Opera: Handel & Mozart,18331,Self-paced on your time,Introductory,Music,English,English,99.0,University,10-20h
Introduction to video game development with Unity,7605,Self-paced on your time,Intermediate,Computer Science,English,English,50.0,University,20-30h
Best Practices for Project Management Success,46610,Self-paced on your time,Intermediate,Business & Management,English,English,150.0,Institute,80h+
Fundamentos de la Tecnología Blockchain,5473,Self-paced on your time,Introductory,Economics & Finance,Español,Español,49.0,University,40-50h
Información financiera y su análisis,5473,Self-paced on your time,Advanced,Economics & Finance,Español,Español,49.99,Other,20-30h
Coaching Skills for Learner-Centred Conversations,8089,Self-paced on your time,Introductory,Education & Teacher Training,English,English,49.0,University,0-10h
Intellectual Property Law and Policy: Part 1,43993,Self-paced on your time,Intermediate,Law,English,English,169.0,University,10-20h
Robotics,68199,Instructor-led on a course schedule,Advanced,Computer Science,English,English,249.0,University,80h+
La gestion des ressources humaines,6824,Self-paced on your time,Introductory,Business & Management,Français,Français,99.0,Other,10-20h
Writing for Social Justice,9927,Self-paced on your time,Introductory,Humanities,English,English,50.0,University,10-20h
Steps in Japanese for Beginners1 Part2,8080,Self-paced on your time,Introductory,Language,English,"English, 日本語",99.0,University,20-30h
Case Studies in Functional Genomics,26850,Self-paced on your time,Advanced,Data Analysis & Statistics,English,English,149.0,University,10-20h
Essential Career Skills for Investment Banking and Finance,11655,Self-paced on your time,Introductory,Business & Management,English,English,49.0,Other,0-10h
Data Structures and Software Design,30609,Self-paced on your time,Intermediate,Computer Science,English,English,149.0,University,30-40h
Unconscious Bias: From Awareness to Action,26659,Self-paced on your time,Introductory,Communication,English,English,49.0,Other,0-10h
Cybersecurity for Critical Urban Infrastructure,5306,Self-paced on your time,Advanced,Computer Science,English,English,100.0,Institute,10-20h
"Agile Process, Project, and Program Controls",16339,Self-paced on your time,Advanced,Engineering,English,English,199.0,University,10-20h
Risk Management in Development Projects,13263,Self-paced on your time,Intermediate,Business & Management,English,English,25.0,Other,20-30h
"Pintura europea: Leonardo, Rembrandt, Goya",32635,Self-paced on your time,Introductory,Humanities,Español,Español,29.0,University,10-20h
Risk & Return,21970,Self-paced on your time,Introductory,Business & Management,English,English,225.0,University,10-20h
Project Management of Engineering Projects: Preparing for Success,42834,Instructor-led on a course schedule,Intermediate,Business & Management,English,English,99.0,University,50-60h
Supply Chain Dynamics,75464,Instructor-led on a course schedule,Advanced,Business & Management,English,English,299.0,Institute,80h+
AWS Developer: Building on AWS,54249,Self-paced on your time,Advanced,Computer Science,English,English,149.0,Other,20-30h
Financial Accounting Made Fun: Eliminating Your Fears,36787,Self-paced on your time,Introductory,Business & Management,English,English,199.0,University,20-30h
PredictionX: John Snow and the Cholera Epidemic of 1854,17713,Self-paced on your time,Introductory,History,English,English,25.0,University,0-10h
Gestión de operaciones,9512,Self-paced on your time,Introductory,Business & Management,Español,"English, Español",119.0,University,30-40h
Microeconomics & Business,10962,Self-paced on your time,Introductory,Economics & Finance,English,English,79.0,University,80h+
Inteligencia artificial: Chatbots sin programación,5001,Self-paced on your time,Introductory,Computer Science,Español,English,49.0,Other,0-10h
Diseño e innovación de modelo de negocios,7180,Self-paced on your time,Advanced,Business & Management,Español,English,99.0,Other,20-30h
Unlocking Investment and Finance in Emerging Markets and Developing Economies (EMDEs),29171,Self-paced on your time,Introductory,Economics & Finance,English,English,5.0,Other,20-30h
Business Communication,0,Self-paced on your time,Introductory,Communication,English,English,199.0,Institute,10-20h
Gestão de riscos em projetos,8771,Self-paced on your time,Intermediate,Business & Management,Português,Português,25.0,Other,30-40h
Vocal Recording Technology,52369,Self-paced on your time,Introductory,Engineering,English,English,49.0,University,30-40h
Agua 2.0: empresas eficientes para el siglo XXI,0,Self-paced on your time,Introductory,Business & Management,Español,Español,25.0,Other,20-30h
IoT Sensors and Devices,33072,Self-paced on your time,Introductory,Computer Science,English,English,199.0,University,20-30h
Introducción a las tecnologías para la Educación,31533,Self-paced on your time,Introductory,Computer Science,Español,Español,49.0,University,10-20h
Fundamentos de la guitarra eléctrica y acústica,13124,Self-paced on your time,Introductory,Music,Español,Español,49.0,University,20-30h
e-Learning on Digital Agriculture,6238,Self-paced on your time,Introductory,Environmental Studies,English,English,5.0,Other,10-20h
Exploring GraphQL: A Query Language for APIs,9503,Self-paced on your time,Introductory,Computer Science,English,English,149.0,Other,10-20h
EmSAT English Preparation - Level 2,7346,Self-paced on your time,Intermediate,Language,English,English,49.0,University,10-20h
The Data Science Method,7868,Self-paced on your time,Introductory,Data Analysis & Statistics,English,English,39.0,Other,30-40h
"Plato, Socrates, and the Birth of Western Philosophy | 西方哲学精神探源",21291,Self-paced on your time,Introductory,Humanities,English,"English, 中文",49.0,University,30-40h
"Cosmic Rays, Dark Matter, and the Mysteries of the Universe",12888,Self-paced on your time,Intermediate,Physics,English,English,49.0,University,10-20h
Macroeconomic Diagnostics,23408,Self-paced on your time,Intermediate,Economics & Finance,English,English,25.0,Other,40-50h
BioStatistics,14937,Self-paced on your time,Introductory,Biology & Life Sciences,English,English,79.0,University,60-70h
Results-Based Project Management: Monitoring and Evaluation,32810,Self-paced on your time,Intermediate,Business & Management,English,English,199.0,University,20-30h
Estrategias y estilos de negociación,12639,Self-paced on your time,Introductory,Business & Management,Español,English,149.0,Other,20-30h
Políticas efectivas de desarrollo infantil,64387,Self-paced on your time,Intermediate,Social Sciences,Español,"English, Español, Português",25.0,Other,40-50h
Alzheimer’s Disease & Dementia Care,5763,Self-paced on your time,Intermediate,Medicine,English,English,49.0,University,10-20h
Understanding Classroom Interaction,27114,Self-paced on your time,Introductory,Education & Teacher Training,English,English,49.0,University,10-20h
Sign Language Science: Emergence and Evolution of Sign Language,8313,Self-paced on your time,Introductory,Language,English,English,99.0,University,10-20h
International Humanitarian Law,31419,Self-paced on your time,Advanced,Law,English,English,150.0,University,80h+
"Educación de calidad para todos: equidad, inclusión y atención a la diversidad",25111,Self-paced on your time,Introductory,Education & Teacher Training,Español,Español,49.0,University,20-30h
Introduction to Astrophysics,20802,Self-paced on your time,Introductory,Physics,English,English,139.0,Other,20-30h
Epidemics I,10618,Self-paced on your time,Introductory,Medicine,English,"English, 中文, 中文",139.0,University,10-20h
Introducción a la genética y la evolución,15297,Self-paced on your time,Introductory,Biology & Life Sciences,Español,Español,49.0,University,0-10h
Fundamentals of Macroeconomics,17820,Self-paced on your time,Introductory,Economics & Finance,English,English,129.0,University,10-20h
"Blockchain and FinTech: Basics, Applications, and Limitations",22011,Self-paced on your time,Introductory,Computer Science,English,"English, 中文",199.0,University,20-30h
Molecular Biology - Part 2: Transcription and Transposition,18168,Self-paced on your time,Advanced,Biology & Life Sciences,English,"English, 中文",99.0,Institute,40-50h
"One Planet, One Ocean",12166,Self-paced on your time,Intermediate,Environmental Studies,English,English,49.0,Other,30-40h
Reputation Management in a Digital World,39672,Self-paced on your time,Intermediate,Communication,English,English,99.0,University,20-30h
Google Ads: publicidad efectiva,12084,Self-paced on your time,Introductory,Business & Management,Español,Español,49.0,University,10-20h
Introducción a la energía solar fotovoltaica: El módulo fotovoltaico,14673,Self-paced on your time,Intermediate,Engineering,Español,Español,50.0,University,10-20h
Computer Vision Fundamentals with Watson and OpenCV,7032,Self-paced on your time,Introductory,Computer Science,English,English,99.0,Other,80h+
Japanese Business Management,14852,Self-paced on your time,Intermediate,Business & Management,English,English,129.0,University,10-20h
Introduction to Cloud Computing,0,Self-paced on your time,Introductory,Computer Science,English,English,49.0,Other,0-10h
Fundamentos de logística,7397,Self-paced on your time,Introductory,Engineering,Español,Español,29.0,Other,30-40h
Sustainable Urban Development,45760,Self-paced on your time,Introductory,Social Sciences,English,English,50.0,University,30-40h
Introduction to Biomedical Imaging,56485,Self-paced on your time,Introductory,Medicine,English,English,99.0,University,50-60h
Introducción a la programación en Java: empezando a programar,23321,Self-paced on your time,Introductory,Computer Science,Español,Español,49.0,University,40-50h
"Circuits and Electronics 2: Amplification, Speed, and Delay",9665,Self-paced on your time,Intermediate,Electronics,English,"English, 中文",169.0,Institute,40-50h
China’s Political and Intellectual Foundations: From Sage Kings to Confucius,47083,Self-paced on your time,Introductory,History,English,"English, 中文",139.0,University,30-40h
Introduction to DevOps and Site Reliability Engineering,8697,Self-paced on your time,Introductory,Computer Science,English,English,149.0,Other,10-20h
SQL aplicado en la  ciencia de datos,0,Self-paced on your time,Introductory,Data Analysis & Statistics,Español,Español,39.0,Other,10-20h
Sign Language Science: Factors Contributing to Nature Structure,0,Self-paced on your time,Introductory,Language,English,English,99.0,University,10-20h
Gender and Intersectionality,0,Self-paced on your time,Introductory,Humanities,English,English,50.0,University,20-30h
Digital Transformation in Business,10118,Self-paced on your time,Advanced,Business & Management,English,English,214.0,University,60-70h
Designing and Creating Trousers,7544,Self-paced on your time,Introductory,Design,English,English,99.0,University,20-30h
Introducción a la teoría política: conceptos y grandes pensadores,11741,Self-paced on your time,Introductory,Social Sciences,Español,Español,59.0,University,30-40h
"Human Rights, Human Wrongs: Challenging Poverty, Vulnerability and Social Exclusion",11426,Self-paced on your time,Intermediate,Social Sciences,English,"English, Русский",49.0,Other,30-40h
Industry 4.0: How to Revolutionize your Business,28404,Self-paced on your time,Introductory,Business & Management,English,English,50.0,University,40-50h
Desafíos y oportunidades en la economía digital,47792,Self-paced on your time,Introductory,Economics & Finance,Español,Español,25.0,Other,20-30h
Pensamiento crítico: toma de decisiones razonadas,16853,Self-paced on your time,Introductory,Business & Management,Español,Español,149.0,Other,20-30h
"MathTrackX: Polynomials, Functions and Graphs",0,Self-paced on your time,Introductory,Math,English,English,79.0,University,10-20h
Sustainable Food Security: Crop Production,35367,Self-paced on your time,Intermediate,Biology & Life Sciences,English,English,49.0,University,40-50h
Network and Security Foundations,7301,Self-paced on your time,Introductory,Computer Science,English,English,299.7,University,70-80h
Cannabis Cultivation and Processing,7419,Self-paced on your time,Introductory,Environmental Studies,English,English,179.0,University,20-30h
"Data, Models and Decisions in Business Analytics",36289,Instructor-led on a course schedule,Advanced,Business & Management,English,Sin dato,249.0,University,80h+
Data Structures Fundamentals,42381,Self-paced on your time,Intermediate,Computer Science,English,English,99.0,University,50-60h
Shaping Work of the Future,22246,Self-paced on your time,Introductory,Business & Management,English,English,49.0,Institute,30-40h
Introducción a la robótica e industria 4.0,7056,Self-paced on your time,Introductory,Computer Science,Español,Español,49.0,University,10-20h
Fighting for Equality: 1950–2018,9274,Self-paced on your time,Intermediate,History,English,English,50.0,University,20-30h
"Design Thinking: Ideation, Iteration and Communication",14629,Self-paced on your time,Intermediate,Business & Management,English,English,299.0,Institute,60-70h
Negotiation Strategies and Styles,0,Self-paced on your time,Intermediate,Business & Management,English,English,149.0,Other,20-30h
Crear música con tecnología,10961,Self-paced on your time,Introductory,Music,Español,Español,49.0,University,20-30h
Análisis de datos: Diseño y Visualización de Tableros,18368,Self-paced on your time,Intermediate,Computer Science,Español,"English, Español",49.0,University,40-50h
Comunicación estratégica: gestión de crisis e imagen pública,7017,Self-paced on your time,Introductory,Communication,Español,Español,49.0,University,10-20h
"Understanding Agribusiness, Value Chains, and Consumers in Global Food Systems",14052,Self-paced on your time,Intermediate,Business & Management,English,English,199.0,University,10-20h
Unlocking Information Security: Part II,6426,Self-paced on your time,Intermediate,Computer Science,English,"اللغة العربية, English, עברית",149.0,University,30-40h
Human Rights Defenders,27338,Self-paced on your time,Introductory,Social Sciences,English,English,49.0,Other,10-20h
Product Design: The Delft Design Approach,87539,Self-paced on your time,Intermediate,Business & Management,English,English,79.0,University,40-50h
Introduction to Psychology | 心理学概论,30731,Self-paced on your time,Introductory,Philosophy & Ethics,中文,English,139.0,University,50-60h
Circuits and Electronics 3: Applications,9347,Self-paced on your time,Intermediate,Electronics,English,"English, 中文",169.0,Institute,60-70h
Vaccines: from smallpox to technologies of the future,6166,Self-paced on your time,Intermediate,Medicine,English,English,49.0,University,20-30h
Le management,6273,Self-paced on your time,Introductory,Business & Management,Français,Français,149.0,Other,10-20h
Circular Economy for a Sustainable Built Environment,8032,Self-paced on your time,Intermediate,Architecture,English,English,50.0,University,20-30h
Agile Innovation and Problem Solving Skills,12667,Self-paced on your time,Advanced,Engineering,English,English,199.0,University,10-20h
International Investment Law,23335,Instructor-led on a course schedule,Advanced,Law,English,English,150.0,University,70-80h
Animation and CGI Motion,36827,Instructor-led on a course schedule,Advanced,Computer Science,English,English,249.0,University,80h+
Terrorism and Counterterrorism,28580,Self-paced on your time,Introductory,Humanities,English,English,49.0,University,60-70h
Découvrir le marketing,30030,Instructor-led on a course schedule,Intermediate,Business & Management,Français,Français,150.0,University,40-50h
Solar Energy: Photovoltaic (PV) Energy Conversion,38041,Instructor-led on a course schedule,Advanced,Engineering,English,English,250.0,University,80h+
Introduction to Actuarial Science,52667,Self-paced on your time,Introductory,Data Analysis & Statistics,English,English,49.0,University,20-30h
PredictionX: Lost Without Longitude,9114,Self-paced on your time,Introductory,History,English,English,49.0,University,0-10h
Information Technology Foundations,6388,Self-paced on your time,Introductory,Computer Science,English,English,399.6,University,50-60h
Introducción a la Inteligencia Artificial de Watson,0,Self-paced on your time,Introductory,Computer Science,Español,Español,49.0,Other,40-50h
Dealing with Power and Dynamics: Discover Your Leadership Style and Influence Stakeholders,16013,Self-paced on your time,Intermediate,Business & Management,English,English,125.0,University,20-30h
Instructional Design and Technology: Learning Theories,21296,Instructor-led on a course schedule,Intermediate,Education & Teacher Training,English,English,299.0,University,70-80h
"Algorithms: Design and Analysis, Part 2",0,Self-paced on your time,Intermediate,Computer Science,English,English,149.0,University,10-20h
