title,num_subscribers,course_type,level,subject,language,subtitles,price,type_ins,duration_interval
Applied Scrum for Agile Project Management,55293,Self-paced on your time,Advanced,Engineering,English,English,199.0,University,10-20h
Corporate Finance,62798,Self-paced on your time,Intermediate,Business & Management,English,"English, हिन्दी",150.0,Institute,20-30h
Judaism Through Its Scriptures,50540,Self-paced on your time,Introductory,Humanities,English,English,99.0,University,30-40h
Excel avanzado: importación y análisis de datos,47184,Self-paced on your time,Advanced,Data Analysis & Statistics,Español,Español,75.0,University,20-30h
CSS Basics,95163,Self-paced on your time,Introductory,Computer Science,English,English,199.0,Other,30-40h
Unlocking Information Security: Part I,19905,Self-paced on your time,Intermediate,Computer Science,English,"اللغة العربية, English, עברית",149.0,University,30-40h
Becoming an Effective Leader,55937,Self-paced on your time,Intermediate,Communication,English,English,99.0,University,80h+
Digital Branding and Engagement,122977,Self-paced on your time,Intermediate,Communication,English,English,99.0,University,10-20h
Introduction to Cybersecurity,73021,Self-paced on your time,Introductory,Computer Science,English,English,199.0,University,20-30h
General Academic English|生活英语进阶,17526,Self-paced on your time,Introductory,Language,English,English,49.0,University,20-30h
Gestión de personas: Recursos Humanos,19687,Self-paced on your time,Introductory,Business & Management,Español,"English, Español",119.0,University,30-40h
From Poverty to Prosperity: Understanding Economic Development,91062,Self-paced on your time,Intermediate,Social Sciences,English,English,149.0,University,10-20h
Medical Terminology,31354,Self-paced on your time,Introductory,Biology & Life Sciences,English,English,79.0,University,60-70h
Ancient Masterpieces of World Literature,48899,Self-paced on your time,Introductory,Literature,English,English,99.0,University,20-30h
Shakespeare's The Merchant of Venice: Shylock,23283,Self-paced on your time,Introductory,Humanities,English,English,49.0,University,20-30h
Gestión del estrés y Mindfulness,15965,Self-paced on your time,Introductory,Health & Safety,Español,Español,49.0,University,10-20h
Behavioural Economics in Action,66764,Self-paced on your time,Introductory,Business & Management,English,English,139.0,University,20-30h
Finance for Everyone: Smart Tools for Decision-Making,45029,Self-paced on your time,Introductory,Business & Management,English,English,49.0,University,30-40h
Creating Innovative Business Models,12227,Self-paced on your time,Introductory,Business & Management,English,English,149.0,University,10-20h
u.lab: Leading From the Emerging Future,79424,Self-paced on your time,Introductory,Business & Management,English,"English, Español, Français, עברית, Indonesian, Italiano, 日本語, Português, Türkçe",99.0,Institute,70-80h
Electric Cars: Introduction,56171,Self-paced on your time,Intermediate,Engineering,English,English,50.0,University,10-20h
Inteligencia Artificial para todos: Domina los fundamentos,11764,Self-paced on your time,Introductory,Computer Science,Español,Español,49.0,Other,0-10h
Marketing Analytics,55228,Instructor-led on a course schedule,Advanced,Business & Management,English,English,249.0,University,80h+
Introducción a la Regulación Emocional basada en Mindfulness,20634,Self-paced on your time,Introductory,Health & Safety,Español,Español,49.0,University,20-30h
Design Thinking Fundamentals,56446,Self-paced on your time,Intermediate,Business & Management,English,English,299.0,Institute,60-70h
Basic Spanish 3: Getting there,17569,Self-paced on your time,Introductory,Language,English,"English, Español",50.0,University,10-20h
Mi propia huerta orgánica,11346,Self-paced on your time,Introductory,Biology & Life Sciences,Español,Español,29.0,University,0-10h
Sustainability in Architecture: An Interdisciplinary Introduction,31352,Self-paced on your time,Intermediate,Architecture,English,English,50.0,University,10-20h
Gestión de riesgos en proyectos de desarrollo,47676,Self-paced on your time,Intermediate,Business & Management,Español,Español,25.0,Other,20-30h
Python Data Structures,36369,Self-paced on your time,Introductory,Computer Science,English,English,49.0,University,20-30h
The Science and Business of Biotechnology,17039,Self-paced on your time,Intermediate,Business & Management,English,English,49.0,Institute,80h+
Finance Essentials,63666,Self-paced on your time,Introductory,Business & Management,English,English,79.0,University,10-20h
Introduction to the Internet of Things (IoT),89421,Self-paced on your time,Introductory,Computer Science,English,English,149.0,University,10-20h
'Talk to me': Improving mental health and suicide prevention in young adults,11481,Self-paced on your time,Introductory,Health & Safety,English,English,139.0,University,10-20h
Disaster Medicine Training,10937,Self-paced on your time,Introductory,Medicine,English,English,50.0,University,10-20h
Nutrition and Health: Human Microbiome,44079,Self-paced on your time,Introductory,Health & Safety,English,English,49.0,University,20-30h
Customer Relationship Management,53085,Self-paced on your time,Intermediate,Business & Management,English,"English, हिन्दी",50.0,Institute,20-30h
Islam Through Its Scriptures,65430,Self-paced on your time,Introductory,Humanities,English,English,99.0,University,30-40h
Mechatronics Revolution: Fundamentals and Core Concepts,11619,Self-paced on your time,Introductory,Engineering,English,English,149.0,Institute,80h+
Accounting for Decision-Making,57710,Self-paced on your time,Intermediate,Business & Management,English,"English, हिन्दी",150.0,Institute,20-30h
C Programming: Language Foundations,46400,Self-paced on your time,Introductory,Computer Science,English,English,49.0,University,20-30h
Big Data sin misterios,65564,Self-paced on your time,Intermediate,Data Analysis & Statistics,Español,Español,25.0,Other,40-50h
Becoming a Successful Leader (Inclusive Leadership Training),215705,Self-paced on your time,Introductory,Communication,English,English,49.0,Other,0-10h
"English for Journalists, Part 1",50847,Self-paced on your time,Intermediate,Communication,English,English,139.0,University,10-20h
Introduction to Networking,16134,Self-paced on your time,Introductory,Computer Science,English,English,150.0,University,20-30h
Accounting Essentials,58463,Self-paced on your time,Introductory,Business & Management,English,English,79.0,University,20-30h
Introduction to Java Programming: Starting to code in Java,325554,Self-paced on your time,Introductory,Computer Science,English,"English, Español, Português, 中文",149.0,University,40-50h
European Paintings: From Leonardo to Rembrandt to Goya,60734,Self-paced on your time,Introductory,Humanities,English,English,99.0,University,10-20h
Java Programming Fundamentals,12042,Self-paced on your time,Intermediate,Engineering,English,English,49.0,University,40-50h
"Hollywood: History, Industry, Art",50033,Self-paced on your time,Introductory,Communication,English,English,169.0,University,10-20h
Data Science Tools,15627,Self-paced on your time,Introductory,Data Analysis & Statistics,English,English,39.0,Other,30-40h
Statistical Thinking for Data Science and Analytics,198861,Self-paced on your time,Introductory,Computer Science,English,English,99.0,University,40-50h
Philosophy and Critical Thinking,97175,Self-paced on your time,Introductory,Humanities,English,English,99.0,University,10-20h
International Law,91868,Self-paced on your time,Advanced,Law,English,English,150.0,University,80h+
Tourism and Travel Management,38503,Self-paced on your time,Introductory,Business & Management,English,English,5.0,University,10-20h
Project Management Life Cycle,120019,Self-paced on your time,Intermediate,Business & Management,English,English,150.0,Institute,80h+
Solar Energy,125069,Self-paced on your time,Introductory,Engineering,English,English,50.0,University,50-60h
Public Speaking,10129,Self-paced on your time,Introductory,Communication,English,English,199.0,Institute,10-20h
Japanese Pronunciation for Communication,62757,Self-paced on your time,Introductory,Communication,日本語,"English, 日本語, 한국어, 中文",99.0,University,20-30h
Mindfulness and Resilience to Stress at Work,33414,Self-paced on your time,Introductory,Business & Management,English,English,199.0,University,0-10h
Framing Your Communication to Inspire and Convince,49351,Self-paced on your time,Intermediate,Business & Management,English,English,125.0,University,20-30h
Business Foundations,55154,Self-paced on your time,Introductory,Business & Management,English,English,150.0,University,20-30h
The Chemistry of Life,78704,Self-paced on your time,Introductory,Biology & Life Sciences,English,English,49.0,University,30-40h
Nutrition and Health: Micronutrients and Malnutrition,78266,Self-paced on your time,Intermediate,Biology & Life Sciences,English,English,99.0,University,40-50h
Digital Design,12339,Self-paced on your time,Introductory,Design,English,English,50.0,University,20-30h
Machine Learning for Data Science and Analytics,140419,Self-paced on your time,Introductory,Computer Science,English,English,99.0,University,40-50h
The Science of Everyday Thinking,318399,Self-paced on your time,Introductory,Business & Management,English,English,99.0,University,30-40h
Gestion de projets de développement,41663,Self-paced on your time,Intermediate,Business & Management,Français,Français,25.0,Other,30-40h
Product Management Fundamentals,11913,Self-paced on your time,Introductory,Business & Management,English,English,199.0,University,10-20h
International Human Rights Law,74424,Self-paced on your time,Advanced,Law,English,English,150.0,University,80h+
The Best Start in Life: Early Childhood Development for Sustainable Development,23139,Self-paced on your time,Intermediate,Education & Teacher Training,English,"اللغة العربية, English, Español, हिन्दी, Português",49.0,Other,20-30h
Data Science and Machine Learning Capstone Project,21809,Self-paced on your time,Intermediate,Data Analysis & Statistics,English,English,99.0,Other,20-30h
"Data Science for Construction, Architecture and Engineering",11113,Self-paced on your time,Introductory,Data Analysis & Statistics,English,English,199.0,University,30-40h
"Nutrition, Heart Disease and Diabetes",24986,Self-paced on your time,Intermediate,Food & Nutrition,English,English,99.0,University,30-40h
Project Management for Development,62099,Self-paced on your time,Intermediate,Business & Management,English,English,49.0,Other,30-40h
Introduction to Cloud Infrastructure Technologies,86923,Self-paced on your time,Introductory,Computer Science,English,English,169.0,Other,40-50h
"Circular Fashion: Design, Science and Value in a Sustainable Clothing Industry",13566,Self-paced on your time,Introductory,Art & Culture,English,English,65.0,University,20-30h
Machine Learning,150855,Instructor-led on a course schedule,Advanced,Computer Science,English,English,249.0,University,80h+
Introducción a la gestión de proyectos,98517,Self-paced on your time,Introductory,Business & Management,Español,Español,50.0,University,20-30h
Free Cash Flow Analysis,36085,Self-paced on your time,Introductory,Business & Management,English,English,225.0,University,10-20h
Lean Production,55926,Self-paced on your time,Introductory,Business & Management,English,English,99.0,University,20-30h
Introduction to Algebra,131197,Self-paced on your time,Introductory,Math,English,English,139.0,Other,20-30h
"LaTeX for Students, Engineers, and Scientists",11823,Self-paced on your time,Introductory,Engineering,English,English,139.0,Other,20-30h
Leading With Effective Communication (Inclusive Leadership Training),107770,Self-paced on your time,Introductory,Communication,English,English,50.0,Other,0-10h
Anatomy: Musculoskeletal and Integumentary Systems,51969,Self-paced on your time,Introductory,Biology & Life Sciences,English,English,49.0,University,10-20h
"Inglés empresarial: ventas, gestión y liderazgo",10897,Instructor-led on a course schedule,Introductory,Business & Management,English,"English, Español",49.0,University,20-30h
Business Strategy from Wharton: Competitive Advantage,26675,Self-paced on your time,Intermediate,Business & Management,English,English,199.0,University,20-30h
Inteligencia emocional para el liderazgo efectivo y colaboración,14726,Self-paced on your time,Introductory,Social Sciences,Español,Español,49.0,University,10-20h
Introducción al desarrollo de aplicaciones web,27757,Self-paced on your time,Introductory,Computer Science,Español,Español,49.0,University,20-30h
"Six Sigma: Analyze, Improve, Control",56016,Self-paced on your time,Introductory,Business & Management,English,English,99.0,University,20-30h
Introducción a la inteligencia emocional,18830,Self-paced on your time,Introductory,Social Sciences,Español,Español,49.0,University,10-20h
AP® Microeconomics,53664,Self-paced on your time,Introductory,Economics & Finance,English,English,49.0,Institute,40-50h
Engineering Calculus and Differential Equations,21535,Self-paced on your time,Introductory,Math,English,English,50.0,University,20-30h
Linear Algebra - Foundations to Frontiers,88570,Self-paced on your time,Intermediate,Computer Science,English,English,49.0,University,80h+
Habilidades de negociación y comunicación efectiva,19614,Self-paced on your time,Introductory,Business & Management,Español,Español,149.0,Other,20-30h
Effective Communication for Today's Leader,8862,Self-paced on your time,Intermediate,Business & Management,English,English,149.0,Other,20-30h
Electric Cars: Technology,40972,Self-paced on your time,Intermediate,Engineering,English,English,50.0,University,10-20h
Site Planning Online,12948,Self-paced on your time,Intermediate,Design,English,English,99.0,Institute,50-60h
Macroeconometric Forecasting,69358,Self-paced on your time,Intermediate,Economics & Finance,English,English,25.0,Other,80h+
Administración pública y fiscal: cómo se gestiona un gobierno,49189,Self-paced on your time,Introductory,Economics & Finance,Español,"Español, Español",25.0,Other,30-40h
Fundamentals of Red Hat Enterprise Linux,53788,Self-paced on your time,Introductory,Computer Science,English,English,99.0,Other,10-20h
Algorithms,61722,Self-paced on your time,Intermediate,Computer Science,English,English,149.0,Other,40-50h
Calculus Applied!,54976,Self-paced on your time,Intermediate,Math,English,English,99.0,University,40-50h
Precalculus,55576,Self-paced on your time,Intermediate,Math,English,English,49.0,University,80h+
Fundamentos de anatomía y técnica quirúrgica básica,12133,Instructor-led on a course schedule,Introductory,Medicine,Español,Español,49.0,University,20-30h
Business Communications,60713,Self-paced on your time,Introductory,Business & Management,English,English,150.0,University,20-30h
Italian Language and Culture: Intermediate (2019-2020),35058,Self-paced on your time,Intermediate,Language,Italiano,Italiano,49.0,University,40-50h
International Women's Health and Human Rights,9796,Self-paced on your time,Introductory,Social Sciences,English,English,50.0,University,30-40h
Blockchain: Understanding Its Uses and Implications,66769,Self-paced on your time,Introductory,Business & Management,English,English,199.0,Other,30-40h
"A-level Mathematics for Year 12 - Course 1: Algebraic Methods, Graphs and Applied Mathematics Methods",22366,Self-paced on your time,Intermediate,Math,English,English,49.0,University,20-30h
Blockchain Technology,55376,Self-paced on your time,Intermediate,Computer Science,English,English,99.0,University,20-30h
Basics of Power BI,8314,Self-paced on your time,Introductory,Data Analysis & Statistics,English,English,49.0,Other,0-10h
Preparing to Network in English,34337,Self-paced on your time,Introductory,Language,English,English,149.0,University,20-30h
Mandarin Chinese Essentials,36665,Self-paced on your time,Introductory,Language,English,English,99.0,Other,30-40h
Human Rights: The Rights of Refugees,84270,Self-paced on your time,Introductory,Humanities,English,English,49.0,Other,10-20h
What do Architects and Urban Planners do?,11046,Self-paced on your time,Introductory,Architecture,English,English,49.0,University,0-10h
"U.S. Political Institutions: Congress, Presidency, Courts, and Bureaucracy",22723,Self-paced on your time,Introductory,Social Sciences,English,English,49.0,University,10-20h
Negotiation Skills and Effective Communication,8146,Self-paced on your time,Intermediate,Business & Management,English,English,149.0,Other,20-30h
AP® English Literature & Composition – Part 1: Stories,15650,Self-paced on your time,Introductory,Humanities,English,English,49.0,University,30-40h
"Viruses & How to Beat Them: Cells, Immunity, Vaccines",28710,Self-paced on your time,Introductory,Medicine,English,English,149.0,University,10-20h
Alianzas: un vehículo para lograr el desarrollo sostenible,17554,Self-paced on your time,Introductory,Social Sciences,Español,English,25.0,Other,30-40h
Designing and Creating Skirts,13954,Self-paced on your time,Introductory,Design,English,English,99.0,University,20-30h
Cómo Aprender Online,7958,Self-paced on your time,Introductory,Education & Teacher Training,Español,"English, Español",49.0,Other,0-10h
Computing in Python II: Control Structures,31511,Self-paced on your time,Introductory,Computer Science,English,English,99.0,Institute,40-50h
Facebook Ads: Cómo utilizar el poder de la publicidad en Facebook,29614,Self-paced on your time,Introductory,Communication,Español,Español,49.0,University,10-20h
Machine Learning Fundamentals,82008,Self-paced on your time,Advanced,Data Analysis & Statistics,English,English,350.0,University,80h+
Pre-University Calculus,103224,Self-paced on your time,Introductory,Math,English,English,50.0,University,50-60h
Tsinghua Chinese: Start Talking with 1.3 Billion People,58834,Self-paced on your time,Introductory,Language,English,English,49.0,University,10-20h
Deep Learning with Python and PyTorch,36195,Self-paced on your time,Intermediate,Data Analysis & Statistics,English,English,99.0,Other,10-20h
Diseña presentaciones eficaces con Powerpoint,36663,Self-paced on your time,Introductory,Computer Science,Español,Español,50.0,University,20-30h
World of Wine: From Grape to Glass,81839,Self-paced on your time,Introductory,Science,English,English,199.0,University,10-20h
Sustainable Cities,16619,Self-paced on your time,Intermediate,Environmental Studies,English,"English, हिन्दी",49.0,Other,40-50h
Introduction to Developmental Psychology,38060,Self-paced on your time,Introductory,Humanities,English,English,99.0,University,10-20h
Creativity & Entrepreneurship,69413,Self-paced on your time,Introductory,Business & Management,English,English,49.0,University,10-20h
College Algebra and Problem Solving,103010,Self-paced on your time,Introductory,Math,English,English,49.0,University,80h+
Academic writing for clarity and meaning,16220,Self-paced on your time,Introductory,Education & Teacher Training,English,English,49.0,University,0-10h
Financial Development and Financial Inclusion,13853,Self-paced on your time,Intermediate,Economics & Finance,English,English,25.0,Other,60-70h
Global Public Health,17273,Self-paced on your time,Intermediate,Health & Safety,English,English,49.0,Other,50-60h
Embedded Systems - Shape The World: Microcontroller Input/Output,69182,Self-paced on your time,Intermediate,Computer Science,English,English,49.0,University,70-80h
Introduction to Animal Behaviour,42135,Self-paced on your time,Introductory,Biology & Life Sciences,English,English,49.0,University,30-40h
Circular Economy: An Introduction,50240,Self-paced on your time,Introductory,Business & Management,English,English,50.0,University,30-40h
Public Financial Management,23288,Self-paced on your time,Intermediate,Economics & Finance,English,English,25.0,Other,40-50h
Anatomy: Human Neuroanatomy,49319,Self-paced on your time,Introductory,Biology & Life Sciences,English,English,49.0,University,20-30h
Android: Introducción a la Programación,85786,Self-paced on your time,Introductory,Computer Science,Español,Español,50.0,University,40-50h
The Ancient Greek Hero,51744,Instructor-led on a course schedule,Introductory,Humanities,English,English,99.0,University,80h+
Agile Leadership Principles and Practices,31838,Self-paced on your time,Advanced,Engineering,English,English,199.0,University,10-20h
How to Code: Simple Data,98113,Self-paced on your time,Introductory,Computer Science,English,English,125.0,University,10-20h
Cybersecurity and Privacy in the IoT,21440,Self-paced on your time,Introductory,Computer Science,English,English,199.0,University,20-30h
Strategic Management,71085,Self-paced on your time,Introductory,Business & Management,English,"English, हिन्दी",150.0,Institute,20-30h
Introducción a la ciencia de datos y sus aplicaciones,7303,Self-paced on your time,Introductory,Data Analysis & Statistics,Español,Español,39.0,Other,20-30h
"Biochemistry: Biomolecules, Methods, and Mechanisms",18692,Instructor-led on a course schedule,Intermediate,Biology & Life Sciences,English,English,150.0,Institute,50-60h
Astronomía Virtual,10500,Self-paced on your time,Introductory,Science,Español,"English, Español",29.0,University,40-50h
Nutrition and Cancer,27144,Self-paced on your time,Intermediate,Food & Nutrition,English,English,99.0,University,30-40h
Build your very first iOS app,31570,Instructor-led on a course schedule,Introductory,Computer Science,English,English,149.0,University,70-80h
Object-Oriented Programming,93633,Self-paced on your time,Introductory,Computer Science,English,English,149.0,Other,20-30h
Introduction to Jenkins,7233,Self-paced on your time,Introductory,Computer Science,English,English,199.0,Other,20-30h
Conducting an Informational Interview,15594,Self-paced on your time,Introductory,Language,English,English,99.0,University,30-40h
Liderazgo y comportamiento organizacional,21419,Self-paced on your time,Introductory,Business & Management,Español,Español,149.0,Other,20-30h
Creative Coding,18660,Instructor-led on a course schedule,Introductory,Design,English,English,249.0,University,80h+
Análisis estadístico con Excel,22717,Self-paced on your time,Introductory,Data Analysis & Statistics,Español,Español,49.0,University,10-20h
Introducción a la Ingeniería del Software,17931,Self-paced on your time,Introductory,Computer Science,Español,Español,49.0,University,20-30h
Computer Graphics,98553,Self-paced on your time,Intermediate,Computer Science,English,"English, 中文",99.0,University,50-60h
Data Science: Computational Thinking with Python,78232,Self-paced on your time,Introductory,Computer Science,English,English,199.0,University,20-30h
Comunicación efectiva para el líder actual,18470,Self-paced on your time,Introductory,Communication,Español,Español,149.0,Other,20-30h
Debate y argumentación,10954,Self-paced on your time,Introductory,Humanities,Español,Español,49.0,University,20-30h
Deep Learning with Tensorflow,37564,Self-paced on your time,Intermediate,Data Analysis & Statistics,English,English,99.0,Other,10-20h
Machine Learning (aprendizaje automático) con Python: una introducción práctica,39155,Self-paced on your time,Introductory,Computer Science,Español,Español,49.0,Other,20-30h
Essential Human Biology: Cells and Tissues,67961,Self-paced on your time,Introductory,Medicine,English,English,169.0,University,10-20h
"Writing, Presenting and Submitting Scientific Papers in English | 英文科技论文写作与学术报告",35720,Self-paced on your time,Intermediate,Communication,English,English,49.0,University,10-20h
Computing in Python III: Data Structures,27239,Self-paced on your time,Introductory,Computer Science,English,English,99.0,Institute,40-50h
Introduction to Internet of Things (IoT),6703,Self-paced on your time,Introductory,Data Analysis & Statistics,English,English,49.0,Other,0-10h
Nutrition and Health: Food Risks,51493,Self-paced on your time,Introductory,Biology & Life Sciences,English,English,49.0,University,50-60h
Mechanics: Kinematics and Dynamics,35529,Self-paced on your time,Intermediate,Physics,English,English,49.0,Institute,80h+
Storytelling for Social Change,30313,Self-paced on your time,Introductory,Communication,English,English,49.0,University,10-20h
Introduction to Data Analytics for Managers,39113,Self-paced on your time,Introductory,Business & Management,English,English,49.0,University,10-20h
Qualitative Research Methods: Conversational Interviewing,21972,Self-paced on your time,Intermediate,Humanities,English,English,49.0,Institute,0-10h
International Project Management,45145,Self-paced on your time,Advanced,Business & Management,English,English,150.0,Institute,80h+
Software Development Fundamentals,51402,Self-paced on your time,Intermediate,Computer Science,English,English,149.0,University,20-30h
"First Nights - Stravinsky’s Rite of Spring: Modernism, Ballet, and Riots",17484,Self-paced on your time,Introductory,Humanities,English,English,49.0,University,10-20h
Critical Thinking & Problem Solving,6558,Self-paced on your time,Introductory,Communication,English,English,199.0,Institute,10-20h
Data Analysis Essentials,42262,Self-paced on your time,Introductory,Business & Management,English,English,79.0,University,30-40h
Master Control in Supply Chain Management and Logistics,31326,Self-paced on your time,Introductory,Business & Management,English,English,49.0,University,30-40h
Work and Employment for a Sustainable Future,6528,Self-paced on your time,Intermediate,Economics & Finance,English,English,49.0,Other,10-20h
Foundations of Data Structures,54075,Self-paced on your time,Intermediate,Computer Science,English,English,149.0,Other,40-50h
